<?xml version="1.0" encoding="UTF-8" ?>

<level-pack name="classic" xmlns:xsi="http://www.w3.org/2001/XMLSchema-instance"
            xsi:noNamespaceSchemaLocation="level-pack-schema.xsd">

    <level id="1" completed="false">
        <game-field>
            <column>
                <cell type="wall" />
                <cell type="empty" />
                <cell type="empty" />
                <cell type="empty" />
                <cell type="start" />
            </column>
            <column>
                <cell type="empty" />
                <cell type="empty" />
                <cell type="empty" />
                <cell type="empty" />
                <cell type="wall" />
            </column>
            <column>
                <cell type="empty" />
                <cell type="wall" />
                <cell type="empty" />
                <cell type="empty" />
                <cell type="empty" />
            </column>
            <column>
                <cell type="empty" />
                <cell type="empty" />
                <cell type="empty" />
                <cell type="wall" />
                <cell type="empty" />
            </column>
            <column>
                <cell type="empty" />
                <cell type="empty" />
                <cell type="wall" />
                <cell type="finish" />
                <cell type="empty" />
            </column>
        </game-field>
    </level>
</level-pack>